URL,Image,title,collectedBy,secondaryCollectors,phylum,family,genus,specificEpithet,infraspecificEpithet,scientificNameAuthorship,identifiedBy,dateIdentified,otherScientificName,scientificName,associatedTaxa,verbatimEventDate,eventDate,country,countryCode,firstPoliticalUnit,secondPoliticalUnit,city,verbatimLocality,locality,Habitat,substrate,verbatimElevation,maximumElevationInMeters,minimumElevationInMeters,verbatimCoordinates,decimalLatitude,decimalLongitude,collectionCode,recordNumber,catalogNumber,language,languageRemarks,originalMethod,typeStatus,occuranceRemarks,sex,reproductiveCondition,generalNotes,expeditionFundedBy,generalInformationAboutThePlantSpecimenItself,rawFormat
https://fm-digital-assets.fieldmuseum.org/276/684/C0000578F.jpg,C0000578F.jpg,Holotype Hepaticae of New Zealand Telaranea lindenbergii var. papillata Engel & Merr.,John J. Engel ,"Matt von Konrat, John E. Braggins",(Division): Marchantiophyta,Lepidoziaceae,Telaranea,lindenbergii,papillata,Engel & Merr.,N/A,N/A,N/A,N/A,"Blechnum novae-zealandiae, Weinmannia, Dicksonia, Leptospermum scoparium",12 February 2003 ,2003-02-12,New Zealand,NZ,Auckland,N/A,Whareorino Forest,"North Island, Auckland Prov.; Whareorino Forest, start of track to Leitch’s Hut",On clayey bank,N/A,Clayey bank,280 meters,280,280,"38° 24.5' S, 174° 49.8' E",-38.4083,174.8300,CRYPTOGAMIC HERBARIUM,23773,1173554,English,N/A,Typed,Holotype,N/A,N/A,N/A,"Supported by the National Geographic Society, The Field Museum",The National Geographic Society,"The plant specimen appears moderate in size, mounted on a herbarium sheet with no soil present","HOLOTYPE HEPATICAE OF NEW ZEALAND Telaranea lindenbergii var. papillata Engel & Merr. On clayey bank. NORTH ISLAND. AUCKLAND PROV.: Whareorino Forest, start of track to Leitch's Hut. 280 meters, 38° 24.5' S, 174° 49.8' E. Clay banks with Blechnum novae-zealandiae overhang, Weinmannia and Dicksonia squarrosa dominant canopy and occasional Leptospermum scoparium. John J. Engel, Matt von Konrat & John E. Braggins, 12 February 2003 No. 23773 (Note: associated data such as barcode, herbarium and catalog number are omitted as requested)."
https://fm-digital-assets.fieldmuseum.org/444/535/C0020052F.jpg,C0020034F.jpg,Hepaticae of Eastern North America,R. M. Schuster,N/A,(Division): Marchantiophyta,(The family in which the taxon is classified),Anastrophylum,minutum,N/A,(The authorship information for the scientific name formatted according to the conventions of the applicable nomenclatural code),N/A,N/A,Diplophyllum taxifolium,N/A,Diplophyllum taxifolium,Aug. 17 68,1968-08-17,Canada,CA,Newfoundland and Labrador,N/A,N/A,"Along Humber River, in Squires Memorial Park, near Route 1A","Humber River, Squires Memorial Park",N/A,N/A,N/A,N/A,N/A,N/A,N/A,N/A,N/A,68-1644,N/A,English,N/A,Typed,no type status,N/A,N/A,+ gemmae,N/A,N/A,N/A,"HEPATICAE OF EASTERN NORTH AMERICA Collected and Determined by R M Schuster No 68-1644 Aug 17 68 Anastrophylum minutum + gemm NEWFOUNDLAND: Along Humber R., in Squires Memorial Park, near Rte 1A With: Diplophyllum taxifolium + gemmae 68-1644a"
https://fm-digital-assets.fieldmuseum.org/445/656/C0025138F.jpg,C0020052F.jpg,Museum Botanicum Hauniense Hepaticae of South Greenland S1,R. M. Schuster,K. Damsholt,Marchantiophyta,N/A,Anastrophylum,minutum,grandis,(Schreb.) Schust.,R. M. Schuster,1982,Cephalozia bicuspidata (L.) Dum.,N/A,Cephalozia bicuspidata (L.) Dum.,July 3,03-07-1982,Greenland,GL,South Greenland,N/A,Frederiksdal,Frederiksdal,Frederiksdal,N/A,N/A,N/A,N/A,N/A,"60°00'N lat., 44°40'W. long.",60.0000,-44.6667,S1,82-1049,N/A,English,N/A,Typed,no type status,N/A,N/A,N/A,N/A,N/A,N/A,"Museum Botanicum Hauniense HEPATICAE OF SOUTH GREENLAND Collected and Determined by R. M. Schuster & K. Damsholt No.82-1049 Anastrophylum minutum (SCHREB.) SCHUST. 1982 Frederiksdal v.grandis (GOTT.) SCHUST. 60°00'N lat., 44°40'W. long. date: July 3. With: Cephalozia bicuspidata (L.) DUM."
https://fm-digital-assets.fieldmuseum.org/409/473/C0025164F.jpg,C0025138F.jpg,Hepaticae of the Nearctic,R. M. Schuster,N/A,(Division): Marchantiophyta,Frullaniaceae,Frullania,asagrayana,N/A,Mont.,N/A,N/A,Plagiochila tridenticulata Dum. (traces),N/A,Abies fraseri,June 30 1951,1951-06-30,United States of America,US,North Carolina,N/A,N/A,"Balsam Gap, N.C., ca. 25 miles north of Asheville, along Blue Ridge Parkway","Balsam Gap, Blue Ridge Parkway",N/A,N/A,5220-5260 feet,1603,1591,N/A,N/A,N/A,N/A,9067,N/A,English,N/A,Typed,no type status,N/A,male,can per (capable perianth),N/A,N/A,"The image provided does not show the plant specimen, thus an assessment cannot be made.","HEPATICAE OF THE NEARCTIC Collected by R. M. Schuster No 9067 Frullania asagrayana Mont. , male, can per. Plagiochila tridentioula Dum. (traces) Balsam Gap, N.C., ca. 25 mi. n. of Asheville, along Blue Ridge Parkway, 5220-5260 feet on Abies fraseri Occurring with:"
https://fm-digital-assets.fieldmuseum.org/444/531/C0020034F.jpg,C0025164F.jpg,Hepaticae of Eastern North America,R. M. Schuster,N/A,(Division): Marchantiophyta,Frullaniaceae,Frullania,asagrayana,N/A,N/A,R. M. Schuster,N/A,N/A,N/A,N/A,April 14 19 79,1979-04-14,United States of America,US,Arkansas,Stone County,N/A,"Stone Co.: Ozark Natl. Forest. Barkshed Camp, ca. 10 miles East of Big Flat.","Ozark National Forest, Barkshed Camp",N/A,N/A,N/A,N/A,N/A,N/A,N/A,N/A,N/A,79-488,N/A,English,N/A,Typed,no type status,N/A,N/A,N/A,N/A,N/A,N/A,"HEPATICAE OF EASTERN NORTH AMERICA Collected and Determined by R M Schuster No 79-488 Frullania asagrayana ARKANSAS: Stone Co.: Ozark Natl. Forest. Barkshed Camp, ca. 10 miles East of Big Flat."
https://www.pteridoportal.org/imglib/fern/F/C0045/C0045536F_1586622756_web.jpg,C0045536F_1586622756_web.jpg,Flora of the United States of America,Thomas G. Lammers,N/A,(Division): Pteridophyta,Dryopteridaceae,Dryopteris,carthusiana,N/A,(Vill.) H. P. Fuchs,Unsure and check,N/A,N/A,N/A,N/A,9 May 1998,1998-05-09,United States of America,US,Illinois,Cook County,N/A,"Cook Co.: Palos Twp., Swallow Cliffs Woods Forest Preserve, southwest of the jct. of US Hwy 45 and State Hwy 83. Local in mesic maple-basswood forest on steep slopes of deep ravine south of toboggan run.","Swallow Cliffs Woods Forest Preserve, Palos Township, Cook County, Illinois",N/A,N/A,N/A,N/A,N/A,N/A,N/A,N/A,N/A,10674,2228497,English,N/A,Typed,no type status,N/A,N/A,N/A,N/A,N/A,"The specimen appears to be a single plant specimen, moderately sized, mounted on a herbarium sheet, with roots present.","FLORA OF THE UNITED STATES OF AMERICA Field Museum of Natural History Dryopteris carthusiana (Vill.) H. P. Fuchs ILLINOIS: Cook Co.: Palos Twp. Swallow Cliffs Woods Forest Preserve, southwest of the jct. of US Hwy 45 and State Hwy 83. Local in mesic maple-basswood forest on steep slopes of deep ravine south of toboggan run. Thomas G. Lammers 10674 9 May 1998"
